"He did, however, contribute to the legitimacy of the double bass as a melodic instrument, open[ing] the door for virtuosos like [Duke Ellington Orchestra bassist] Jimmy Blanton to garner more respect for the instrument, through improvisation.",1
"Drummer Jo Jones recalled an instance when somebody was fooling around [in the band], Mr. Walter Page left his bass, went down quiet as a cat, got the baritone, played the sax parts, and went back to his place.",1
Page is perhaps best known for his work with the Count Basie Orchestra from 1935 to 1942.,1
"Page, drummer Jo Jones, guitarist Freddie Green, and pianist Count Basie became known as the All-American Rhythm Section and set the standard for jazz rhythm sections that is still emulated and considered the gold-standard today.",1
"Page's playing was a great influence on Jo Jones, who says that it was Page who really taught him to play in Kansas City: 'An even 4/4'.",1
"Indeed, Berliner notes that During the swing period, Walter Page's largely stepwise walking bass accompaniment in Count Basie's band epitomized the changing emphasis on the four-beat approach to meter described by Foster.",1
"Jo Jones describes the dynamic of the rhythm section as a process and a group endeavor: We worked at it, to build a rhythm section, every day, every night.",1
The work of Charles Mingus has also received attention in academia.,1
"According to Ashon Crawley, the musicianship of Charles Mingus provides a salient example of the power of music to unsettle the dualistic, categorical distinction of sacred from profane through otherwise epistemologies.",1
"Crawley offers a reading of Mingus that examines the deep, imbrication uniting Holiness-Pentecostal aesthetic practices and jazz.",1
Mingus recognized the importance and impact of the midweek gathering of black folks at the Holiness-Pentecostal Church at 79th and Watts in Los Angeles that he'd attend with his stepmother or his friend Britt Woodman.,1
" Emphasis is placed on the ethical demand of the prayer meeting felt and experienced that, according to Crawley, Mingus attempts to capture.",1
"In many ways, Wednesday Night Prayer Meeting was Mingus's memorial, homage, to black sociality.",1
"By exploring Mingus' homage to black Pentecostal aesthetics, Crawley expounds on how Mingus figured out that those Holiness-Pentecostal gatherings were the constant repetition of the ongoing, deep, intense mode of study, a kind of study wherein the aesthetic forms created could not be severed from the intellectual practice because they were one and also, but not, the same.",1
"Gunther Schuller has suggested that Mingus should be ranked among the most important American composers, jazz or otherwise.",1
"In 1988, a grant from the National Endowment for the Arts made possible the cataloging of Mingus compositions, which were then donated to the Music Division of the New York Public Library for public use.",1
"In 1993, The Library of Congress acquired Mingus's collected papers—including scores, sound recordings, correspondence and photos—in what they described as the most important acquisition of a manuscript collection relating to jazz in the Library's history.",1
"When with the Jeter-Pillars Orchestra, Blanton added classical music pizzicato and arco techniques to jazz bass, making it into more of a solo instrument.",1
"His importance was such that, until the advent of the styles of Scott LaFaro and Charlie Haden in the 1960s all modern bass players drew on his innovations.",1
Early examples of Jamerson's impact are Rescue Me by Fontella Bass and,1
You Won't See Me and Nowhere Man by the Beatles.,1
"Bassists who have noted Jamerson's contribution or been influenced by him include Rocco Prestia, Anthony Jackson, Pino Palladino, Paul McCartney, Bob Babbitt, Nathan Watts, Will Lee, Geddy Lee, Chuck Rainey, Marcus Miller, Mike Mills, Phil Chen, John Entwistle, Michael League, Mike Watt, Sting, John Paul Jones, Bernard Odum, Victor Wooten, Robert DeLeo, Glenn Hughes, Tommy Shannon, Suzi Quatro, Ron Asheton, Tony Sales, Peter Cetera, Robert Kool Bell, Bootsy Collins, Michael Flea Balzary, Jaco Pastorius, Stanley Clarke, Jack Bruce, John Patitucci, Jason Newsted, Rick Danko, Garry Tallent, Alan Gorrie, Jerry Jemmott, Andy Fraser, Matt Noveskey, Brian Wilson and others.",1
Dan Boeckner of Wolf Parade stated in a 2010 interview that he had played with Daddy's Hands for a time.,1
Brooke Cannon of Atlas Strategic joined the band for their 2002 lineup.,1
Johnny Pollard was a founding member of Atlas Strategic along with Boeckner and Cannon.,1
Jonah Fortune and Christoph Hofmeister later played with Pink Mountaintops.,1
"Both Dailor and Atoms credit Stevie Wonder, early Genesis, and other 70s progressive rock as influences for Arcadea.",1
Gus G's first influences began with Peter Frampton and his work,1
"When asked about Uli Jon Roth, Gus G. stated, 'He's a guy that I took my band's name (Firewind) from.  ",1
"If you listen to Uli Jon Roth, what he was doing back in the 70s with the Scorpions, and of course, with Electric Sun, you'll see, Ohh, now I know where all the 80s shredders like Yngwie and all those guys got their inspiration from.  ",1
"Gus also cites Al Di Meola, Joe Stump, John Norum, Steve Vai, John Petrucci, Yngwie Malmsteen, George Lynch, ",1
"Uli Jon Roth, Michael Schenker, Paul Gilbert, Marty Friedman, Jimi Hendrix, Jimmy Page, Gary Moore, The Beatles, The Doors, Black Sabbath, Metallica, Iron Maiden, Joe Satriani and many others as his influences.",1
Bon Jovi,1
/Def Leppard with a few other smaller influences in the mix.,1
"He lists his vocal influences as Ray Gillen (Badlands), Joe Elliott, Kip Winger and Joey Tempest.",1
"Music critics have compared Penniless to a number of mostly American rock bands, including Pixies, Hüsker Dü, Weezer and Nirvana.",1
"Penniless guitarist, vocalist and main songwriter Ossi Alisaari has cited The Who and Sonic Youth among his influences.",1
"The band play a hybrid genre of music known as death-doom, which blends elements of death metal and doom metal, claiming influence from bands such as Candlemass, Cathedral, Paradise Lost, Asphyx and Winter, among others.",1
"While Richard, Jonta and Tomas all were band mates in Mozes, and played individually in various melodic death metal bands, Richard felt more musically influenced by bands like Motörhead and Pantera.  ",1
"Music style and influence Since most of the group grew up in the South Bay, they were highly influenced by the reggae, rock, punk culture and bands like Sublime, Pepper, Pennywise among others.   ",1
 The band has also described their sound as “Steel Pulse meets Hendrix.,1
"American fusion bands such as Living Colour and Bad Brains were significant early influences on the band's lyrics and style, with the group explaining that Natty Nation has got that hardness, but then it’s got that one love thing.",1
"CL cites 1TYM leader Teddy Park, who produced much of 2NE1's music, as an influence and inspiration, as well as Madonna, Queen, and Lauryn Hill.",1
V coined the phrase I purple you during BTS' fanmeeting in November 2016.,1
"Ever since then, purple has become a symbol of BTS and their fans.",1
"UNICEF also used the phrase for their anti-bullying campaign in collaboration with BTS.In 2018, Eugene Investment & Securities Co., Ltd. conducted analytical research on Google search trends relating to the K-pop industry.",1
"In  a survey conducted by Gallup Korea he was chosen as the 4th most preferred idol of 2019 while ranking 9th in 2018.Various artists have cited him as an influence and role model, such as The Boyz's Younghoon and Hwall, Golden Child's Jaehyun and Jangjun, MVP's Been,",1
"Rainz's Byun Hyun-min, Cravity's Serim, Ateez's Yeosang and Mingi, D-Crunch's Jungseung and Dylan, Lucente's Bao,",1
"Newkidd's Yunmin, Boy Story's Hanyu, TXT's Beomgyu,",1
"Produce X 101 contestants Koo Jungmo,  Lee Taeseung and Mahiro Hidaka, and former Wanna One member Park Ji-hoon.",1
"In October 2018, Jungkook broke the record of most real-time viewers with his solo live broadcast in V Live history with more than 3.7 million viewers worldwide.",1
"Various artists have cited him as an influence and role model, such as Kim Dong-han and Hyeongseop X Euiwoong.",1
"A wine that Jungkook had been drinking while filming a live stream on V Live, Merlot March wine, sold out shortly after the broadcast.",1
"In September 2019, Korean media reported that Jungkook had created a 'Modern Hanbok' trend in the Korean entertainment industry, as many celebrities such as Jun Hyun-moo, Jang Do-yeon, Gong Hyo-jin, MC Oh Seung-hwan and The Return of Superman's Park Joo-ho all started wearing it because of Jungkook.",1
"Musical style and influences Park's production style often incorporates contemporary R&B, especially when working with Taeyang and Seven.",1
"He also features reggae in his songs, acknowledging the genre's influence on 2NE1's debut EP.",1
"His work with 2NE1's first full-length album and 2011 EP contained songs that are pop and dance, in addition to featuring house elements.",1
The song Lonely by 2NE1 was praised for its acoustic sound.,1
Park also experimented with electronic music when working with Big Bang.,1
"That same year, he and G-Dragon tied for the most earned royalties for lyrics writing and song composition within the field of popular music from the Korean Music Copyright Association.",1
The Beatles' emergence overlapped with the decline in British conservatism.,1
"In the description of author and musician Bob Stanley, their domestic breakthrough represented a final liberation for Britain's teenagers and, by coinciding with the end of National Service, the group effectively signaled the end of World War II in Britain.",1
"He instead charmed the theatre audience with his final comment: For our last number ['Twist and Shout'], I'd like to ask your help.",1
"Burns states that the quality and preponderance of scholarly, quasi-scholarly, journalistic, and fan attention given to the band far surpasses that given to Bob Dylan, the Rolling Stones and the Beach Boys.",1
"In her book The Rock Canon, Carys Wyn Jones affords them an elevated status akin to Shakespeare's position of eminence in Harold Bloom's canon of Western literature.",1
"Since the early 2000s, historian Mark Lewisohn has been writing The Beatles: All These Years, a three-part set of Beatles biographies whose first volume exceeds 1,700 pages.",1
"In 2019, a scientific study involving over 80,000 different chord progressions and conducted by the Max Planck Institute in Germany indicated Ob-La-Di, Ob-La-Da as the perfect pop song based on how enjoyable recipients found its chord changes.",1
"They have cited influences including Motörhead, Trouble, The Obsessed and Type O Negative.",1
"Phinius Gage plays fast, melodic hardcore music in the style of Pennywise, Strung Out, Consumed, Rise Against, and other bands of the SoCal description from record labels including Fat Wreck Chords and Epitaph.",1
"Zombie Ghost Train included a cover of Teddy Boy Boogie, on their Dealing The Death Card album. ",1
"Singer Sparky Phillips from Demented Are Go recorded with Hillbilly Moon Explosion a version of Teddy Boy Flick Knife Rock'n'Roll, on the album The Sparky Sessions.  ",1
Klingonz covered Trouble Trouble on their Still Stompin album.,1
"Core Acacia members Sigsworth and Nilere had originally bonded over a mutual interest in John Cage and Karlheinz Stockhausen, but retained their parallel (and more commercial) interest in pop melodies with very strange arrangements.",1
"White has a mezzo-soprano vocal range, and her style has been compared often to that of M.I.A.",1
" Santigold and her friend Amanda Blank have been described as being part of a new crop of young, multicultural, female acts in the wake of M.I.A. causing a stir on the Internet and in indie-label conference rooms.White",1
"has also revealed her appreciation of new wave music, saying that My Superman is an interpolation of a Siouxsie and the Banshees' song, Red Light.",1
 The singer's main influences are James Brown and Aretha Franklin,1
and she has cited Devo as her ultimate favorite band.,1
" White also grew up listening to a lot of reggae, jazz, Fela Kuti and Nigerian music.",1
"Artists such as Joan Jett and the Blackhearts, the Rolling Stones, Bruce Springsteen, Van Halen, Tom Petty, Rod Stewart, T. Rex, Cliff Richard, the Who, Stray Cats, the Beach Boys, the Beatles, Led Zeppelin, the White Stripes, the Sex Pistols, Sid Vicious, Rush, Simple Minds, George Thorogood, Guitar Wolf, Paul McCartney, Alan Jackson, the Move, David Bowie, Jimi Hendrix, Johnny Hallyday and U2 have covered his songs. ",1
It was because Paul McCartney knew the chords and words to Twenty Flight Rock that he became a member of the Beatles.,1
"Jimi Hendrix performed Summertime Blues early in his career, and Pete Townshend of the Who was heavily influenced by Cochran's guitar style (Summertime Blues was a staple of live performances by the Who for most of their career, until the death of bassist and vocalist John Entwistle in 2002, and is featured on their album Live at Leeds).",1
"San Francisco Sound band Blue Cheer's version of Summertime Blues was their only hit and signature song, and has been described as the first heavy metal song.",1
"The glam-rock artist Marc Bolan had his main Gibson Les Paul guitar refinished in a transparent orange to resemble the Gretsch 6120 played by Cochran, who was his music hero.",1
"He was also an influence on the guitar player Brian Setzer, of Stray Cats, who plays a 6120 almost like that of Cochran, whom he portrayed in the film La Bamba.",1
"Cultural influence Space and Cerys Matthews released The Ballad of Tom Jones, a song about a fighting couple who are calmed down by listening to Jones's music on the radio.",1
Mickie Most's skill in the '60s was to make pop music out of British blues and R&B and folk; Chinn and Chapman's skill in the '70s has been to make pop music out of an audience.,1
"Musician Tina Weymouth, who played bass guitar in Talking Heads and Tom Tom Club, among other bands, first learned to play bass by listening to Quatro albums.",1
Quatro had a direct influence on the Runaways and Joan Jett and Girlschool and Chrissie Hynde from The Pretenders.,1
"Mid-1990s American indie rock band Tuscadero was named after Quatro's Happy Days character Leather Tuscadero, and their song Leather Idol, from their 1994 album The Pink Album, was an ode to both Quatro and her TV character.",1
"On the cover of Scottish singer-songwriter KT Tunstall's 2007 album Drastic Fantastic, Tunstall is dressed like Quatro, as a deliberate homage.",1
"The award was bestowed by Kathy Valentine (formerly of The Go-Go's) at a dinner in her honour in Austin, Texas, at the Austin Renaissance Hotel.",1
Quatro performed five songs with a local band that included her sister Patti and Tony Scalzo of the band Fastball on Stumblin In.,1
"This trend continued through his video game score Tom Clancy's Splinter Cell: Chaos Theory Soundtrack, and by his sixth album, Foley Room, all of the source material was recorded in the field by himself.",1
"Despite his indirect connection with Brazilian genres, Tobin collaborated with a number of artists on Bebel Gilberto's 2000 bossa nova album Tanto Tempo.",1
"Tobin's albums are often compared to soundtracks, and he says that movies by David Lynch have influenced him.",1
"The duo have listed a wide range of musical influences, including ABBA, Elton John, The Eurythmics, Annie Lennox, Peter Gabriel, Frank Sinatra, The Cardigans, Prince, Erasure, Imogen Heap, The Pretenders, Scissor Sisters, The Cure, Stevie Wonder, Depeche Mode, Queen, Blondie, Heart, Michael Jackson, Radiohead, and Phoenix.",1
"Mayer Hawthorne is influenced by the music of Curtis Mayfield, Isaac Hayes, Leroy Hutson, Mike Terry, Barry White, Smokey Robinson and the legendary songwriting and production trio of Lamont Dozier, Brian Holland, and Edward Holland, Jr.",1
(known collectively as Holland–Dozier–Holland).,1
"Taking umbrage at the notion that his is a purely throwback soul sound, however, Hawthorne also cites more contemporary artists, such as J Dilla, Hanne Hukkelberg, and Santigold, as significant influences.",1
lines—I've taken what I can from the classic heroes of soul and updated it with the music I grew up listening to and loving like Public Enemy and Juan Atkins and Cybotron.,1
"Musical style and influences During an interview on Chrome Children, Madlib stated that his most significant musical influences include Miles Davis, Sun Ra, and David Axelrod.",1
"Some of his rap influences are Large Professor, Marley Marl, Paul C, DJ Pooh, and Dr. Dre.",1
Rapper Mos Def said about Muldrow: ,1
"As a young man Rebennack was interested in New Orleans voodoo, and in Los Angeles he developed the idea of the Dr. John persona for his old friend Ronnie Barron, based on the life of Dr. John, a Senegalese prince, conjure man, herb doctor and spiritual healer who came to New Orleans from Haiti.",1
"In addition to Dave Tough and Jo Jones, Manne admired and learned from contemporaries like Max Roach and Kenny Clarke, and later from younger drummers like Elvin Jones and Tony Williams.",1
"Manne was often experimental, and had participated in such musically exploratory groups of the early 1950s as those of Jimmy Giuffre and Teddy Charles.",1
"In 1957, critic Nat Hentoff called Manne one of the most musical and illuminatively imaginative drummers.",1
Composer and multi-instrumentalist Bob Cooper called him the most imaginative drummer I've worked with.,1
"In later years this kind of appreciation for what Manne could do was echoed by jazz notables like Louie Bellson, John Lewis, Ray Brown, Harry Sweets Edison, and numerous others who had worked with him at various times.",1
"Composer, arranger, bandleader, and multi-instrumentalist Benny Carter was a great admirer of his work. ",1
He contrasted his style with that of Max Roach: Max plays melodically from the rhythms he plays.,1
"Broonzy's influences included the folk music, spirituals, work songs, ragtime music, hokum, and country blues he heard growing up and the styles of his contemporaries, including Jimmie Rodgers, Blind Blake, Son House, and Blind Lemon Jefferson.",1
"Broonzy combined all these influences into his own style of the blues, which foreshadowed the postwar Chicago blues, later refined and popularized by artists such as Muddy Waters and Willie Dixon.",1
"In 2007, he was inducted into the first class of the Gennett Records Walk of Fame, along with 11 other musical greats, including Louis Armstrong, Jelly Roll Morton, Gene Autry, and Lawrence Welk. ",1
"Broonzy as an acoustic guitar player inspired Muddy Waters, Memphis Slim, Ray Davies, John Renbourn, Rory Gallagher, Ben Taylor, and Steve Howe.",1
"In the September 2007 issue of Q Magazine, Ronnie Wood, of the Rolling Stones, cited Broonzy's track Guitar Shuffle as his favorite guitar music.",1
"Eric Clapton has cited Broonzy as a major inspiration, commenting that Broonzy became like a role model for me, in terms of how to play the acoustic guitar.",1
The Derek and the Dominos album Layla and Other Assorted Love Songs includes their recording of Key to the Highway. ,1
"Another musician heavily influenced by Broonzy was Jerry Garcia, who upon hearing a recording of Broonzy's blues playing decided to exchange an accordion he received on his 15th birthday for an electric guitar.",1
"Garcia would later co-found The Grateful Dead, who frequently performed a number of songs which Broonzy had recorded decades earlier, including C.C. Rider and Goin' Down the Road Feelin'",1
"In the benediction at the 2009 inauguration ceremony of President Barack Obama, the civil rights leader Rev. Dr. Joseph Lowery paraphrased Broonzy's song Black, Brown and White Blues.",1
"As part of the PopUp Archive project, in collaboration with the WFMT network, the Chicago History Museum, and the Library of Congress, an hour-long interview of Broonzy, recorded on September 13, 1955, by Studs Terkel was made available on-line.",1
"His favorite mute was a small metal mute made by the C.G. Conn Instrument Company, with which he played his famous solo on his composition the Dippermouth Blues (an early nickname for fellow cornetist Louis Armstrong).",1
"He credited jazz pioneer Buddy Bolden as an early influence, and in turn was a major influence on numerous younger cornet/trumpet players in New Orleans and Chicago, including Tommy Ladnier, Paul Mares, Muggsy Spanier, Johnny Wiggs, Frank Guarente and, the most famous of all, Armstrong.",1
"One of his protégés, Louis Panico (cornetist with the Isham Jones Orchestra), authored a book entitled The Novelty Cornetist, which is illustrated with photos showing some of the mute techniques he learned from Oliver. ",1
"As mentor to Armstrong in New Orleans, Oliver taught young Louis and gave him his job in Kid Ory's band when he went to Chicago.",1
"Fender associated with swamp pop musicians such as Joe Barry and Rod Bernard and issued many recordings on labels owned by Huey Meaux, a Cajun who specialized in swamp pop.",1
"After her death, her popularity among the Hispanic population was compared to those of Marilyn Monroe and Madonna in Anglo-American culture.",1
"Selena became the third female artist to sell over 300,000 units in one week, after Janet Jackson and Mariah Carey.",1
"It was also believed her death open[ed] the doors to other Latin musicians such as Jennifer Lopez, Ricky Martin, and Shakira.",1
"In 1995, the United States Social Security Administration ranked the name Selena one of the 100 most popular names for newborn girls, and namesake Selena Gomez acknowledged Quintanilla's influence.",1
"Musical style and influences Smith respected and was inspired by many artists and styles, including The Beatles, Big Star, The Clash, The Who, Led Zeppelin, The Kinks, Pink Floyd, Rush, Elvis Costello, Oasis, Television, Motown and flamenco records, AC/DC, Hank Williams, and Scorpions",1
", Smith claimed to listen exclusively to selected albums (such as The Marble Index by Nico) for months.",1
"He liked classic literature, especially Samuel Beckett, T. S. Eliot, and Russian novelists such as Fyodor Dostoyevsky.",1
"Smith mentioned his admiration for Bob Dylan in several interviews, citing him as an early influence.",1
"Smith has also been compared to folk singer Nick Drake, due to his fingerpicking style and vocals.",1
"Smith was a dedicated fan of The Beatles (as well as their solo projects), once noting that he had been listening to them frequently since he was about four years old and also claimed that hearing The White Album was his original inspiration to become a musician.",1
"Although this was the only Beatles song that Smith ever officially released, he is known to have recorded many others, (Revolution, I'll Be Back and I'm So Tired) and played many songs by both the band and the members' solo projects at live concerts.",1
"Larry Crane, Smith's posthumous archivist, has said that he was surprised at the amount of recycling of musical ideas",1
"After signing with Chess Records in 1960, James broke through as a traditional pop-styled singer, covering jazz and pop music standards on her debut album, At Last!",1
"James has influenced a wide variety of musicians, including Diana Ross, Christina Aguilera, Janis Joplin, Bonnie Raitt, Shemekia Copeland, and Hayley Williams of Paramore as well as British artists",1
"The Rolling Stones, Elkie Brooks, Paloma Faith, Joss Stone Rita Ora, and Adele, and the Belgian singer Dani Klein. ",1
Vaya Con Dios covered the song on their 1990 album Night Owls.,1
"Another version, performed by Christina Aguilera, was in the 2010 film Burlesque.",1
"Pretty Lights sampled the song in Finally Moving, followed by Avicii's dance hit Levels, and again in Flo Rida's single Good Feeling.",1
"Clark mentioned that singers such as David Bowie and Kate Bush had inspired her, as had Jimi Hendrix and Siouxsie and the Banshees.",1
"She said in a 2015 lecture she listens to a Bowie track every day, and that It's No Game (Part One)",1
"Talking Heads, Patti Smith and Pink Floyd are also influences, as well as guitarists Robert Fripp and Adrian Belew (both from King Crimson), Marc Ribot and Adam Jones from Tool.",1
"Hallim cites Mariah Carey, Whitney Houston, Christina Aguilera, Sam Cooke, Sade, Amy Winehouse, India.",1
"Arie, Patsy Cline and Bob Marley as her musical influences.",1
"Furthermore she mentioned Brandy as major inspiration, naming her the only artist that had her starstruck next to Prince.",1
"She also cited Janet Jackson's career as inspirational, who she called an icon.",1
"She called Lauryn Hill's The Miseducation of Lauryn Hill the album that changed her perspective, calling it an amazing body of work.",1
"She explained that [m]y parents were big music lovers and played soul music all the time, who would play The Supremes, The Ronettes and Cooke, as well as Caribbean music like soca, calypso and reggae.",1
"She has received comparisons to Amy Winehouse, Lauryn Hill, Macy Gray, Chrisette Michele, Marsha Ambrosius and Jill Scott.",1
"stated that his musical style was influenced by underground music, rather than mainstream music, and that his influences included hip hop and funk artists such as Funkadelic, Rick James, Roger Troutman, Egyptian Lover and Parliament.",1
"Ice is a big fan of 50's and 60's reggae and Bob Marley's work and has also stated that he enjoys Rage Against the Machine, Slipknot, and System of a Down.",1
"In 2014, while on The Voice, Usher called her a baby Céline Dion.",1
"Graham Nash said, I'm amazed at the range and the control and the depth of her voice.",1
Shakira deemed her high register out of this world.,1
