"The Redland has citied Tupac, John Legend, Bob Dylan and Common as their influencers.",1
Rolling Stone described their music as idiosyncratic and inspired by the Afrocentric psychedelics of George Clinton and Sly Stone.,1
"One central motif of OutKast's songwriting is the duality of the two members and their differing personalities, with Big Boi as the player and Andre 3000 as the poet.",1
"Big Boi generally covers the more conventional hip-hop topics such as his childhood in the South, sex, and partying, while Andre 3000 discusses more unorthodox themes.",1
"The band's influences include Marilyn Manson, Kiss, Metallica, Pantera, Avenged Sevenfold, Mötley Crüe, Poison, AFI, W.A.S.P., Rob Zombie, L.A. Guns, Aerosmith, Misfits, Dead Boys, The Damned, Slipknot, Dropkick Murphys, David Bowie, Queen, Twisted Sister, Def Leppard, Skid Row, Social Distortion, Rise Against, Billy Idol, Alice Cooper and Hot Water Music.",1
"In an interview Christian Coma cited his greatest musical influences as Pendulum, Deadmau5, As I Lay Dying, In Flames, and Rise Against while also adding that former Slipknot drummer Joey Jordison is his influence on heavy metal music.",1
 Gonzalez cites Françoise Hardy as his favorite singer and Miles Davis as having great impact.,1
"The band also includes The Cowboy Junkies' album The Trinity Session, Julee Cruise, and Cocteau Twins as influences.",1
"Mazzy Star Music bloggers behind Swell Tone describe Cigarettes After Sex as a band producing melancholy, slow pop that will sweetly rock any listener into a listless stupor.Reviewing",1
"The group lists Run-DMC, Michael Jackson, LL Cool J, N.W.A, Geto Boys, Tupac Shakur, Notorious B.I.G., X-Clan, Spice 1, Esham, Natas and Public Enemy as influences.",1
Esham defined the genre as analogous to modern day blues [or] heavy metal.,1
AllMusic writer Jason Birchmeier said that Mastamind's rapping owes little to any conventional style.,1
"Natas is known for using live instrumentation, as well as for highly sample-based instrumentation which Allmusic compared to that of The Bomb Squad and Dr. Dre.",1
"Rappers influenced by Natas include Insane Clown Posse, Eminem and Kid Rock.",1
"Perhaps one of the best examples of this is the guitar riff heard at 3:06 on the song The Machine Stops, which gives a direct indication of Panopticon era Isis.",1
"Cult of Luna, Isis, Envy, Thrice, This Will Destroy You, Sigur Rós, Mono, Thursday, Underoath, Death Cab for Cutie.",1
"After a number of initial appearances alongside well-established acts in the genre, such as Manu Chao, Chervona quickly gained the attention of the Portland music scene and has since surpassed Miru Mir!",1
"Among his major influences he lists Lou Reed and The Beatles, of which only bootleg recordings were available in his native St. Petersburg, Russia.",1
"They have cited August Burns Red, Misery Signals, Born of Osiris, and Saosin as musical influences.",1
Cove Reber and Anthony Green of the bands Saosin and Circa Survive have been noted as a particular influence on Jesse Cash's vocals.,1
"Influences for their musical style have come from a wide variety of bands including The Dillinger Escape Plan, Radiohead, and Björk.",1
"Björk, particularly, was noted as being an inspiration for former vocalist Krysta Cameron's sung vocals.",1
"Campbell, in a Let's Play with Achievement Hunter said that Motion City Soundtrack were a huge influence for the band.",1
The Wonder Years have been listed as a big influence for British band As It Is.,1
"Benoit & Sergio cite a wide variety of influences from electronic artists such as Isolée, Thomas Melchior, and Ricardo Villalobos to rock musicians, including Talking Heads, Pavement, Roxy Music, and Paul Simon.",1
"Steven Blush, author of American Hardcore: A Tribal History, writes that they vied with Minor Threat as the top [Washington, D.C. hardcore] band in 1981–1982 and that Legless Bull best exemplified smartass suburban HC.",1
"But by 1982, with Brian Baker and Tom Lyle in the lineup, the band began to develop a sound more akin to heavy rock than pure hardcore.",1
"Steve Huey of Allmusic notes that the band carried the torch for traditional hardcore punk on their early records, but evolved into something more adventurous by adding bits of metal, new wave pop, and psychedelia.",1
"By 1986's Government Issue Stabb was moving in a more melodic direction influenced by the gothic rock of The Damned, and by 1988's Crash the group was at its most musically diverse.",1
"Picciotto, Janney and Canty formed One Last Wish with Embrace alumnus, guitarist Michael Hampton.",1
"The Rites of Spring personnel reunited for a quasi-reincarnation called Happy Go Licky, releasing an LP/CD of various live concert recordings though never producing any studio work.",1
"Picciotto and Canty eventually teamed up with bassist Joe Lally and former Minor Threat, Skewbald/Grand Union, Egg Hunt, and Embrace singer Ian MacKaye (co-owner of the band’s label, Dischord Records) in Fugazi.",1
"Mike Fellows went on to do session work for the Drag City label and form Miighty Flashlight, releasing an eponymous album under this name in 2002.Picciotto himself doesn't recognize the attribution of having created emo.",1
"The reason I think it's so stupid is that - what, like the Bad Brains weren't emotional?",1
"Guitarist Kris Norris said in an interview, Well, put it this way – if you took an encyclopedia of metal, you could list just about every Scandinavian band as our influences!",1
"It’s not really any one particular band; we wouldn't say that we’re influenced by, say, In Flames or At The Gates, it’s every band from there. ",1
"Other influences include: Dark Tranquillity, Minor Threat, Earth Crisis, Bad Brains, Black Flag, Government Issue, Scream, Shadows Fall, Bleeding Through, Eighteen Visions, Every Time I Die, Entombed, Dismember, Sacrilege, The Crown, Metallica, Megadeth, Slayer, Anthrax, Iron Maiden, Dream Theater, Carcass, Arch Enemy, Killswitch Engage, Sick of it All, Dead Kennedys, Soilwork, Danzig, Venom, Exodus, Discharge, Cro-Mags, Integrity, Edge of Sanity, Mayhem, Emperor, Ulver, Testament, Death Angel, Pantera, and Cannibal Corpse.",1
"Darkest Hour's main guitar influences are: Zakk Wylde, Dimebag Darrell, James Hetfield, Dave Mustaine, and Scott Ian.",1
"Scheidt cites a varied range of artists as inspiration for Yob's sound, including Neurosis, Tool, Immolation, Saint Vitus,  Cathedral, Soundgarden, Deep Purple, The Obsessed,  Candlemass, Judas Priest, Pentagram, Trouble, Led Zeppelin, Black Sabbath, King Crimson, and Pink Floyd.",1
"In their native Oregon, the Daddies have been called a Northwest institution, having been inducted into the Oregon Music Hall of Fame in 2009.",1
"If you're a Eugenean, however, you might think of swing, thanks to [the] Cherry Poppin' Daddies.",1
"Seattle's The Rocket commented on the band's influence in 1997, stating [t]he Daddies were busting out the swing before the Squirrel Nut Zippers, stirring cocktails before Combustible Edison and skating the ska before Sublime ...",1
"Emerging from the New York hardcore scene, Prong, along with bands such as Pantera, Sepultura and Machine Head, is one of the bands of the groove metal movement of the 1990s.",1
Prong cites Killing Joke and Chrome as influences.,1
"Prong has influenced many notable musicians such as Korn's Jonathan Davis, Demon Hunter's Ryan Clark, and Nine Inch Nails' Trent Reznor.",1
"Style and influences Originally formed as a traditional Afrobeat ensemble, Kokolo quickly developed a far spikier sound, often played faster and more emphatically than many of their contemporaries.",1
"Lugo's songwriting approach is largely informed by punk, rock and reggae, and contrary to many contemporary Afrobeat groups' reliance on more Jazzy instrumentals, Kokolo's songs feature re-occurring vocal choruses, which are designed to engage and energize audiences at live shows.",1
"Their live performances also vary drastically from that of their peers, as Kokolo's shows are more frenzied and akin to rock concerts, another indication of the influence of groups like Bad Brains and Mano Negra on the group. ",1
"Since forming, they have evolved into a prolific recording machine, with over 50 releases on their discography and features in scores of notable international compilations, alongside artists like Femi Kuti, Ska Cubano, Tony Allen, U-Roy, Caetano Veloso, Masters At Work, Quantic, Salif Keita, Gerardo Frisina, Baaba Maal, Jazztronik, Zero 7, Afro Celt Sound System, Joe Bataan, Common, The Orb, Eric B & Rakim and many more. ",1
later went on to both father the famous basketball player and become music director for The Stylistics.,1
"Citing influences, Hill has named bands such as Neurosis, Swans, Joy Division, Darkthrone, Black Flag, Deathspell Omega, Leviathan and Bauhaus, among others, as being influential to the group's sound.",1
"They have met with individuals such as banjo player, Pat Conte, Alice Gerrard, Clyde Davenport, the late fiddler Joe Thompson.",1
Marcos Hassan from Tinymixtapes listed the severity of Swans and the depraved cabaret mold of The Birthday Party as the sound they've been honing together.,1
Reid Bateh has mentioned the films of Wong Kar Wai and David Lynch and the moods portrayed in them as influences on their sound.,1
Issa Gold credits Lupe Fiasco and Kanye West as his greatest musical influences.,1
"The group also significantly listens to other genres of music, with Gold saying his favorite artist is John Mayer.",1
"Issa also includes artists like, Fleet Foxes, The Lumineers, Freddie Gibbs and more.",1
"The band has cited Poison Idea, Celtic Frost, Black Sabbath, Metallica, Agnostic Front, Possessed, Sodom, Kreator, Carnivore, Venom, Twisted Sister, Mercyful Fate, Darkthrone, Bad Brains and Black Flag as their influences.",1
"The band was originally titled Hütz and the Béla Bartóks, but Eugene Hütz says that they decided to change the name because nobody knows who the hell Béla Bartók is in the United States.",1
"On 27 April 2010 Gogol Bordello made its major record label debut with Transcontinental Hustle on Rick Rubin's American Recordings, a subsidiary of Columbia Records/Sony Music Entertainment.",1
"They have made numerous appearances at international festivals and have toured with such diverse bands as Primus, Flogging Molly, and Cake.",1
"In an interview with NPR, frontman Eugene Hütz cites Jimi Hendrix and Parliament-Funkadelic as among the band's main musical influences.",1
"They have also mentioned Manu Chao, Fugazi, Zvuki Mu, Karamelo Santo, Sasha Kolpakov and The Clash as influences. ",1
"He cites Porter Robinson, Benny Blanco, Pretty Lights, and JR Rotem as major influences.",1
"Shapiro's musical influences include Robert Johnson, Janis Joplin, Muddy Waters, and his favorite, Big L.",1
"Several fan societies have sprung up in the official forums including the Jake Groupies, Ana Matronic Appreciation Society, and the Scissor Sisters Party Bus; the latter two having spilled over to their own sites.",1
Television also drew inspiration from minimalist composers such as Steve Reich.,1
"Tom Verlaine has often cited the influence of surf bands the Ventures and Dick Dale to Television's approach to the guitar, and he has also expressed a fondness for the bands Love and Buffalo Springfield, two groups noted for their dual-guitar interplay.",1
"Television's ties to punk were underscored by their late '60s garage rock leanings, as the band often covered the Count Five's Psychotic Reaction and the 13th Floor Elevators' Fire Engine in concert.",1
"Lester Bangs heard in Television's music the influence of Quicksilver Messenger Service, noting a similarity between Verlaine's guitar playing and John Cipollina's.",1
"Tom Verlaine has downplayed the comparison, citing the Ventures as a more apt reference point.",1
"Kip Winger, in description of the band's musical ability and style, said, Our band was known to musicians, and a lot of musicians showed up to see me play — watching, trying to figure out how I'm playing.",1
We were like the 'hair band' [version of] Dream Theater.,1
"the Horizon's Sempiternal, Deftones's eponymous fourth album, Slipknot's Iowa, Atreyu's the Curse and Poison's",1
"Some of the group's major musical influences are Pachora, Paradox Trio, The Bad Plus, Mahavishnu Orchestra, King Crimson, and Tool.",1
"In 2010, they opened for another major influence, Victor Wooten.",1
"A rival hip-hop collective, known as the Juice Crew's lyrics, were misunderstood to contain a claim in the song The Bridge that hip hop was directly a result of artists originating from Queensbridge.",1
"Boogie Down and KRS retorted angrily with songs such as “The Bridge is Over” and “South Bronx,” which started one of the first notable hip hop wars as MC Shan, Marley Marl, Roxanne Shanté and Blaq Poet all released songs featuring verses personally attacking KRS and Scott La Rock.",1
"The Bridge Wars, however, were only short-lived, and after the death of Scott La Rock prior to the group's second album, KRS began to concentrate on socially conscious music. ",1
Producer Lee Smith was dropped and KRS-One adopted the Teacha moniker and made a deliberate attempt at creating politically and socially conscious hip-hop.,1
"However, the group was sometimes overshadowed by Public Enemy.",1
", criticism regarding the music industry, cartoonish violence reminiscent of the Geto Boys, and esoteric references to the Nation of Gods and Earths.",1
Gravediggaz' ironism influenced hardcore techno through Mark Newland's sampling of the group's prose in Nasenbluten.,1
"The musical style of the band is influenced from European metal bands of the mid- and late-1970s with a sound similar to Queensrÿche, Black Sabbath, Pantera.",1
"Ricky Young acknowledged the influence of The Band on the group's sound, but pointed out that there were many other inspirations behind The Wild Feather's sound.",1
"The Wild Feathers have cited acts like Tom Petty, The Eagles, and Otis Redding as inspirations.",1
"The Lonely Biscuits blend several genres of music to produce their sound; influences cited include Sublime, Beastie Boys, Jurassic 5, G. Love, and Jack White.",1
"Blaster's sound is often compared to that of the Dead Kennedys or Man or Astro-man?, though headman Otto Bot (stagename for Daniel Petersen) denied any direct influence.",1
"A review by HM compared the music to the combined sounds of werewolf movies, Elvis, and the Sex Pistols (among others), further stating that this is what CREATIVE Christian music sounds like.  ",1
"His father's liking for jazz then exposed him over the next few years to the music of Glenn Miller, Ray Charles, and Dave Brubeck.",1
"R.E.M.'s Peter Buck admitted, We've sort of flirted with greatness, but we've yet to make a record as good as Revolver or Highway 61 Revisited or Exile on Main Street or Big Star's Third.",1
"2014, Paul Stanley cited Big Star as an influence to early Kiss moments: We've always been about verses, choruses, bridges (...)",1
Give me the Raspberries.,1
Give me Small Faces.,1
"In 1992, Rykodisc generated further interest in the band when it reissued Third/Sister Lovers and released a posthumous compilation of Bell's solo material, I Am the Cosmos.",1
"Rolling Stone includes #1 Record, Radio City and Third/Sister Lovers in The 500 Greatest Albums of All Time and September Gurls and Thirteen in The 500 Greatest Songs of All Time.",1
"In addition to R.E.M., artists including Teenage Fanclub, The Replacements, Primal Scream, the Posies, and Bill Lloyd and the dB's cite Big Star as an inspiration, and the band's influence on Game Theory, Matthew Sweet, and Velvet Crush is also acknowledged. ",1
"The 1987 tribute song Alex Chilton, co-written by three members of the Replacements, was released as a single from the album Pleased to Meet Me and contains the lyric I never travel far without a little Big Star. ",1
I'm in Love with a Girl from Radio City features in the soundtrack of the 2009 film Adventureland. ,1
(recorded by Todd Griffin) was used as the theme song for the sitcom,1
In the Street) was recorded by Cheap Trick also specifically for the show.,1
", Small World  includes Big Star covers by the Posies, Teenage Fanclub, Gin Blossoms, Wilco, the Afghan Whigs, and Whiskeytown, among others. ",1
"Lucero, a Memphis, Tennessee-based alternative country band, covered",1
I'm in Love with a Girl on their 2015 release,1
"Founding member Jody Stephens, and later additions to Big Star, provide backup on the track. ",1
The band's name is an anagram of the group Seagulls Trio and a reference to the Donkey Kong 3 arcade game.,1
", Davidson cites Slash, Dimebag Darrell, and Marty Friedman.",1
"Davidson says that as a band, Revocation has a wide range of influences, and among these are groups such as Children of Bodom, Exhorder, Dark Angel, Slayer, Megadeth, Pestilence, Atheist, Gorguts, Forbidden, Spastic Ink, Martyr, and Exodus.",1
The Dresden Dolls are a dark cabaret band.,1
"In her influences, Palmer named Cyndi Lauper, Laurie Anderson and Kate Bush",1
"She was also inspired by the likes of Bauhaus, The Cure, The Legendary Pink Dots, Robyn Hitchcock and Nick Cave.",1
"The band cite Elvis Presley and Buddy Holly, plus metal bands such as Iron Maiden, Skid Row, Def Leppard, and Dokken, as influences.  ",1
"When the group first started out, they drew numerous influences from the likes of punk rock groups such as Sublime, Operation Ivy, Rancid, and Streetwise.",1
"Their reggae influences stem from artists such as Yellowman, Don Carlos (musician) and Buju Banton.",1
The Otherside off the album Chronchitis features the late rapper Guru.,1
"a Mouse, Pinchers, and Tenor Saw quite often.",1
"The band took influences from John Zorn, Swing Kids, Miles Davis, Drive Like Jehu, Bad Brains and Fugazi.",1
"The band cites Dying Fetus, Dark Funeral, Slayer, Cannibal Corpse, The Black Dahlia Murder, Immolation, Dååth, Dissection, In Flames, and Carcass as their main influences.",1
"On the album, the band emphasized their black metal influences more, such as Mayhem, Burzum, Emperor, Watain, Bathory, and Cradle of Filth, among others.",1
In the early days the band were influenced by metal bands such as Necrophagist and post-hardcore band,1
"The Fall of Troy, but the band have also listed pianists such as Hiromi Uehara, Tigran Hamasyan, and Alex Argento as influences in their sound.",1
Heavy metal writer Garry Sharpe-Young described the band as a Christian Hardcore act employing the Grind edged vocals of singer Tim Lambesis and a distinct hint of Scandinavian guitar chug.,1
"As I Lay Dying's influences include In Flames, Living Sacrifice, Iron Maiden, Slayer, At the Gates, Pantera, Megadeth, Fear Factory, Cannibal Corpse, Thin Lizzy, Shai Hulud, Dark Tranquility, Metallica, Judas Priest, and Earth Crisis.",1
"The Meat Purveyors have a wide range of influences, as evidenced by the variety of artists that they pay tribute to in their recorded covers, including songs by Ronee Blakley, Nick Lowe, ABBA, Foreigner, The Human League and Ratt.  ",1
"The band cites their influences to include Fugazi, Melvins, Bikini Kill, KARP, Unwound, Sonic Youth, Led Zeppelin, Rush, Genesis, Pink Floyd, Public Enemy, Yes, J.S. Bach and Vivaldi.",1
Dave Richards Erie Times-News' described the band's sound as blending the progressive aspirations of Muse with the openhearted approach of emotional and muscular power of bands like Breaking Benjamin.,1
"Influences of Starset include Hans Zimmer, Nine Inch Nails, Sigur Ros, Thirty Seconds to Mars, Deftones, Linkin Park and Breaking Benjamin.",1
"My Last has cited that some of their musical influences range from The Used, Incubus, Blindside, Jimmy Eat World, 36 Crazyfists, Bless",1
"The Fall, A Day To Remember, Sevendust, and Story Of The Year.",1
"But, I mean, if you look at us as a metalcore band and then you look at, say, you know, Hatebreed as a metalcore band, which a lot of people say Hatebreed is a metalcore band because they've got some sort of metal-y riffs.",1
"Many reviews categorized the band's early releases as post-rock, and compared them to other bands of the genre, most notably fellow Texas instrumental group Explosions in the Sky, although the band members largely reject this description.  ",1
"They mention Misfits, International Noise Conspiracy, and The Zombies as influences and have been compared with The Hives, The Strokes, Richard Hell, Dion & the Belmonts, The Animals, The Von Bondies, and Black Rebel Motorcycle Club.",1
"The band's major influences stemmed from late 1970s punk acts like the Ramones, the Germs, the Sex Pistols and the Clash, along with such early 1980s American hardcore bands as Black Flag, Minor Threat, and the Circle Jerks.",1
"Unlike many other hardcore bands of the era, they also acknowledged proto-punk bands like the New York Dolls, MC5 and Iggy Pop.",1
"Even more unusual for a band of the scene that spawned them, they were also informed by such new wavers as Elvis Costello, the Jam, and Nick Lowe, as well as authors like Jack Kerouac.",1
The Beatles were also a huge influence on Bad Religion.,1
Greg Graffin called his influences pop-sounding rock tunes that were not necessarily commercial.,1
Brett Gurewitz acknowledges attempting to emulate Germs singer Darby Crash early on in Bad Religion's lyrical style. ,1
"Bassist Jay Bentley says, Seeing the Adolescents live, it was so brilliant.",1
"turn, various punk bands cite Bad Religion as an influence, including AFI, ALL, Authority Zero, the Bouncing Souls, Death by Stereo, Kreator, Lagwagon, NOFX, the Offspring, Pennywise, and Rise Against.",1
"Funeral for a Friend vocalist Matt Davies-Kreye has also mentioned Bad Religion as an influence, particularly with their Against the Grain album.",1
"Suicidal Tendencies have been influenced by a variety of genres, including punk rock, speed metal, hardcore punk, surf music, heavy metal and reggae, such as Jimi Hendrix, the Ramones, the Sex Pistols, the Beatles, Led Zeppelin, Pink Floyd, Rush, Black Flag, the Germs, Dick Dale, Black Sabbath, the Circle Jerks, T.S.O.L., the Who, the Middle Class, the Simpletones, China White, the Hated, Motörhead, the Plugz, the Big Boys, War, Bob Marley and Frank Zappa.",1
"Critics have also described Suicidal Tendencies as the godfathers of the genre crossover thrash, which they have been credited for creating along with Texas-based band D.R.I. and New York-based band Stormtroopers of Death. ",1
"Various artists have expressed their admiration for Suicidal Tendencies or have cited them as an influence, including Anthrax, Biohazard, Children of Bodom, Death By Stereo, Dub War, Green Day, Jane's Addiction, Incubus, Killswitch Engage, Korn, Limp Bizkit, Megadeth, Metallica, MxPx, NOFX, The Offspring, P.O.D., Pantera, Papa Roach, Pennywise, Rage Against the Machine, Sepultura, Sevendust, Slayer, Slipknot, Soulfly, Staind, System of a Down, Terror and Hank Williams III.",1
"In his journals, Nirvana  guitarist Kurt Cobain listed  Saccharine Trust's  Paganicons as one of his Top 50 favorite albums.",1
Buzz Osborne of The Melvins stated in the book,1
Sonic Youth covered their song ,1
"Double bassist Damon Smith has credited the album with altering his views on punk rock, jazz, and free-form jamming.",1
Weasel Walter has described Saccharine Trust as true modernists.,1
"During the time before Thes One and Double K met through the early years as People Under the Stairs, the group attended hip hop shows at many of the Los Angeles venues (such as the Good Life Café) that were a part of the explosion of West Coast hip hop acts.",1
"In numerous interviews, the group has cited many of these groups that had a direct or peripheral influence on their sound, including Freestyle Fellowship, The Pharcyde, Jurassic 5, The Beatnuts, and many others. ",1
The group has paid direct homage to A Tribe Called Quest on the song Check the Vibe on 2009's Carried Away.,1
"Double K grew up listening to DJ Jazzy Jeff & The Fresh Prince, Public Enemy,",1
"West Coast gangsta rap such as DJ Quik and Eazy-E, and a large amount of 1980s disco rap.",1
" In a 1993 interview with Los Angeles Times, the group's member Myka 9 said, What we are is liberators, liberating rap from its R&B/funk structures--that 4/4 (time) prison.",1
"Watt identifies The Who, The Rolling Stones, and Led Zeppelin as influences on his style, while Bonham has compared the guitarist to Jimi Hendrix.",1
"The band's debut album was written equally by its three members, and has been described as a mix between the classic rock elements of Black Country Communion – big, meat-cleaver riffs and heart-rending vocals – but with a 21st-century gloss.",1
"The Descendents have been cited as hugely influential to a large number of modern-day pop punk and skate punk bands such as Blink 182, NOFX, Green Day, Pennywise, Propagandhi, Rise Against, The All-American Rejects, The Bouncing Souls, The Offspring, and The Ataris.",1
"Blink is absolutely a product of The Descendents, said Blink-182 vocalist/guitarist Tom DeLonge in 2011, while vocalist/bassist Mark Hoppus called Silly Girl from",1
"In 2014, Filmage: The Story of Descendents/All, a documentary on the band, premiered.",1
"The film features interviews with Hoppus, Dave Grohl of Nirvana and Foo Fighters, and Mike Watt of Minutemen.",1
"The German edition of the Rolling Stone's The 500 Greatest Albums of All Time ranked it at 349.In 2016, a Descendents branded IPA entitled Feel This Coffee",1
"The band has cited The Beatles, Fall Out Boy, The Rolling Stones, Michael Jackson, Bruce Springsteen, Elvis Presley, The Beach Boys, INXS, Jimi Hendrix, Led Zeppelin, Prince and Queen as big musical influences.",1
