"Musical style and influences Since his teens Sinclair has been particularly influenced by Prince, Stevie Wonder, Jimi Hendrix and Sly Stone. ·  ",1
He describes his discovery of the album Songs in the Key of Life by Stevie Wonder as a revelation.,1
Her debut album's music was compared to work by Aretha Franklin and Macy Gray.,1
Ferguson cites Aretha Franklin as one of the artists who had the biggest influence on her.,1
"Aretha Franklin to me is like the queen of soul, so on one hand, I like being compared to her, but on the other hand, I don't think I’ve achieved anything yet to be compared to someone who, to me, is an absolute legend.",1
She cites band Kings of Leon as an inspiration.,1
On the question of collaborating with Kings of Leon,1
"but you never know, I could rock out with the Kings of Leon.",1
"Ferguson also cites the late soul singer Amy Winehouse as one of her biggest influences, stating that she respected Winehouse as she was real and wasn't in it for the fame, she was artistic and her music is lovely.",1
"She also cites Sam Cooke, Otis Redding and Nina Simone among her influences.",1
"Smith's vocal style has been compared to that of post-punk singers such as Ian Curtis of Joy Division, Paul Banks of Interpol, Robert Smith of The Cure and Michael Stipe of R.E.M..",1
"His use of falsetto was prominent on Editors' third album, In This Light and on This Evening.",1
Smith has stated that most of Editors' music begins with him composing on his piano or his acoustic guitar.,1
Definitely Maybe and Parklife by Oasis and Blur respectively.,1
"2006, Smith stated that Murmur by R.E.M. was his favourite album of all time.",1
"Editors drummer, Edward Lay concurred in an interview in Winter 2005, saying, Tom's favourite album is R.E.M.'s Murmur, so they were his favourite band whilst growing up",1
"He has also expressed admiration for performers such as Bruce Springsteen, describing him as a legendary artist who's still got that magic he started with, Mogwai (a favourite since he was a teenager), Prefab Sprout and Peter Gabriel, despite overcoming initial skepticism that Gabriel was music for your dad.",1
"Melua has stated that the rock band Queen were a huge influence on her as a child/teenager, with one of her memories of music being her uncle playing records by Queen and Led Zeppelin.",1
She performed with Queen at the 46664 concert in South Africa in March 2005.Melua appeared on the BBC's The Culture Show in November 2006 advocating Paul McCartney as her choice in the search for Britain's greatest living icon.,1
"Spendlove is influenced from a wide range of music starting from his early childhood, including The Beatles.",1
"Dan Wilde cites Bob Dylan, Neil Young, Tom Waits and Paul Simon among those who have influenced his music.",1
"The Beatles, The Kinks.",1
"American Pop Punk bands such as: Green Day, The Ataris,",1
"Singer songwriters Frank Turner, Elvis Costello, Marit Larsen, Edwina Hayes and Britpop bands such as Oasis and Blur.",1
"She also got trained under Neyveli Santhanagopalan, Injikudi Ganesan, Rukmini Ramani, Chidambaram Shanmukham, Geetha Srinivasan & Guru Lakshmi.",1
She has been likened to Ella Fitzgerald many times and one writer called her the next heiress in the bloodline of young women with supernaturally classic voices.,1
She has a diverse musical preference from The Carpenters to The Cranberries.,1
"She draws inspiration from Cat Power, Regina Spektor, Leonard Cohen, Tom Waits, Jolie Holland, Daniel Johnston and Chris Garneau, Billie Holiday, Ella Fitzgerald, Velvet Underground and Led Zeppelin.",1
"Summer's musical influences include Frank Zappa, Al Green and Dinah Washington.",1
"She cites Aretha Franklin, Joss Stone, Jhené Aiko and Tracy Chapman as influences when she was younger.",1
Some of her early stages' work has been compared to Laura Pausini.,1
Levante music influences cames from italian songwriter Carmen Consoli to american singer Alanis Morissette.,1
"she cities Mina, Cristina Donà, Janis Joplin, Tori Amos and Kristina Train.",1
"When I talk about pop, I also put Nirvana in the middle.",1
Bartholomew is a self-professed Beatles and Led Zeppelin fanatic and has cited Magical Mystery Tour and Led Zeppelin as his favorite albums.,1
"In 2006, Bartholomew opened for two of his musical heroes Ron Sexsmith and Bachman-Cummings.",1
Bartholomew states that The Beatles played a major part in his childhood and considers them to be the greatest band of all time.,1
" Bartholomew has also named producer, Dave Sardy as his most important modern production influence.",1
played over hip hop beats and his sound has been compared to that of musician Everlast.,1
KO is a fan of Nirvana and has cited Kurt Cobain as a musical influence — Kurt Kobain is also the title of a single from his debut album.  ,1
"In the bio section of KO's official website he also states that he is still influenced by Toronto's underground rap community and lists Everlast, Kid Rock, Ani DiFranco, Thelonious Monk and Van Morrison as some of his favourite artists.",1
"Daniel's musical influences range from cartoon music (Milt Franklyn, Carl Stalling), impressionist music (Claude Debussy, Maurice Ravel), avant-garde",1
"(György Ligeti, Luigi Nono, Edgard Varèse), electronic",1
"(Luciano Berio, Tod Dockstader, İlhan Mimaroğlu, Karlheinz Stockhausen), classical (Johann Sebastian Bach, Igor Stravinsky), ambient (Steve Roach), as well as big band music (Benny Goodman).",1
"Vahnke has also admitted to admiring modern rock artists such as The Young Gods, Einstürzende Neubauten, Tom Waits, Sigur Rós, and The Blue Nile.",1
Angèle is a fan of Ella Fitzgerald and Hélène Ségara.,1
"The latter is greatly inspired by her main influence, Rory Gallagher.",1
"She is well known for her use of fingerpicking technique and various complex guitar tunings, much like one of her other sources of inspiration, Nick Drake.",1
"Ville Valo, the frontman of the Finnish rock band HIM, regards Rautavaara as his greatest idol in Finnish music.",1
"Osama has been quoted to be heavily influenced by Eminem and Nelly and has stated listening to their respective LPs, The Marshall Mathers LP and Country Grammar, are the initial reason the rapper started writing lyrics and making songs.",1
"In another interview posted on Modern Ghana's website, Efya cited Kojo Antwi, Aretha Franklin and The Temptations as her key musical influences.",1
"In a 2014 interview with SmoothJazz.com, Camille said that her biggest vocal influences were Stevie Wonder, Joni Mitchell, Carmen McRae and Barbra Streisand, while crediting the recordings of Oscar Peterson for her early musical development and ear training.",1
"The Austin American-Statesman described Venson as a Gary Clark Jr.-level talent who speaks boldly through her guitar while entrancing with her gorgeous, smoky voice.",1
"Venson's influences include Buddy Guy, Sade, and Alicia Keys.",1
Her voice has been compared to Joss Stone and Amy Winehouse.,1
"In 1991, Il est cinq heures, Paris s'éveille was voted the best French-language single of all time in a poll of music critics organised by Le Nouvel Observateur for a TV special broadcast on Antenne 2, beating Jacques Brel's Ne me quitte pas into second place.",1
"Dutronc's songs have been covered by Matthieu Chedid, Vanessa Paradis, Mungo Jerry, Etienne Daho, Sylvie Vartan, Miles Kane, The Divine Comedy, Serge Gainsbourg, Black Lips, and Zine among others.",1
"The 13-track album titled Joyeux anniversaire M'sieur Dutronc contained performances by artists Julien Doré, Gaëtan Roussel, Zaz, Joeystarr , Nathy (Tüxo),  BAGARRE, Thomas Dutronc, Annie Cordy, the duo Brigitte, Miossec, Francis Cabrel, Francine Massiani, Tété and Camélia Jordana in addition to L'opportuniste sung by Jacques Dutronc with Nicola Sirkis.",1
"Arijit has shared his fondness for Kishore Kumar, while citing Mohit Chauhan and Atif Aslam  as inspirations with whom he is often compared.",1
"Though he has been inspired by many artists, Singh named KK as his favorite singer along with Ayushmann Khurrana.",1
"He named Pritam Chakraborty, Vishal–Shekhar, Shankar–Ehsaan–Loy, Amit Trivedi, Mithoon and A. R. Rahman as his favorite music directors.",1
"Singh has idolized Ghulam Ali, Jagjit Singh and Mehdi Hassan.",1
"In an interview with Filmbeat in April 2013, he declared that he is the biggest fan of singer Krishnakumar Kunnath (KK).",1
"In an interview with The Indian Express, Singh stated that he loves the work of Shalmali Kholgade, Shefali Alvares, and Irfan.",1
He also mentioned that his current favorite singer is Chinmayi.,1
"The singer stated during interviews that her reference artist are Alicia Keys, Paolo Nutini, Dua Lipa and Billie Eilish.",1
The singer describes Laura Pausini and Elisa as main points in the contemporary Italian music scene.,1
"In several interviews, Mengoni has claimed that one of his most relevant influences is The Beatles.",1
"Mengoni also cited David Bowie, Michael Jackson and Renato Zero among his most relevant influences.",1
"May'n's musical style varies in genre, ranging from pop and rock, to dance music and R&B, and she cites artists such as Britney Spears, Madonna, Janet Jackson, and Namie Amuro as her musical influences.",1
She also cites her relationship with composer Yoko Kanno as a major factor in her career.,1
"In interviews with Anime News Network, May'n discussed her performance style and her experiences working with composers such as Kanno and Daisuke Asakura.",1
"Like labelmate Aira Mitsuki, she is also involved in the heavy use of Auto-Tune and vocoders and her songs",1
are sometimes compared also to some of Yasutaka Nakata's works and produced acts.,1
"During her time in Akihabara, she performed songs by AKB48, Hello!Project, and labelmates 80 Pan. ",1
"She has covered Shangri-La by Denki Groove, Sakura by Kyogo Kawaguchi, and",1
Ez Do Dance by TRF amongst others. ,1
"Her debut album, Japanese Chaos featured a Denpa remix by noted gabber and nerdcore producer DJ Sharpnel",1
"She cited Nina Simone,  Billie Holiday, Lara Fabian, Diana Krall and Norah Jones as her favourite artists, as well as Elena Obraztsova, whom in her formative years she regarded 'a goddess'.",1
"During her recording of the Emerald track in the Lenkom Theatre Studios, the actor Aleksandr Abdulov passingly remarked: You sing of an Emerald as if it were a cobble-stone.",1
"Mendes has cited John Mayer, Ed Sheeran, Justin Timberlake, and Bruno Mars as his main musical influences.  ",1
"Growing up, Mendes listened to reggae music, Led Zeppelin, Garth Brooks, and country music thanks to his parents.",1
"He expressed that his second studio album was influenced by Mayer's work while his third album was inspired by Timberlake, Kings of Leon, Kanye West, and Daniel Caesar.",1
"Guerra cites Juan Luis Guerra, Michael Bublé and Luis Miguel as her influences.",1
Currently maintains a relationship with actor Miguel Ángel Muñoz.,1
"She sang with Aitana, Lola Índigo, Raoul and Agoney for the Coca-Cola advertising campaign for Christmas.",1
She will perform with Aitana and Greeicy the song Lo malo during Premio Lo Nuestro 2019.,1
" She has been compared to the artists, Jeff Buckley, Hiatus Kaiyote, Kimbra, and Angie Stone and her music both expands and transcends musical boundaries.",1
"Her sound was described by Jordan Hirst of Music Feeds, as a combination of Mary J. Blige and Erykah Badu's voices mixed with M.I.A.'s genre-bending sensibility.",1
Tembo has been influenced by Mos Def and Chance the Rapper.,1
"She has performed as a supporting act for Joey Bada$$, as well as Kendrick Lamar, Thundercat, and Denzel Curry.",1
He has stated that his two music idols are Bon Jovi and Marc Cohn.,1
"The composers Jaidev Kumar, Sukhpal Sukh, Sachin Ahuja, Pavneet Birgi, Jassi Bros Bhinda Aujla, and Tru Skool have all influenced him.",1
"She mentions Tata Young and Beyoncé Knowles as her inspirations, besides Indonesian pop diva,",1
"Krisdayanti She also cites the girl group Pussycat Dolls, Rihanna, Kim Kardashian, (whom when has been compared to) and Jacqueline Kennedy Onassis as her fashion inspirations.",1
"Marc Anthony, is a key component in the evolution of Mary Ann as a professional singer, has grown with his music and",1
"Among Mary Ann's many achievements was: being proclaimed as La Voz de Puerto Rico, being an ambassador for this title as Lucecita Benítez, who is known as La Voz Nacional de Puerto Rico.",1
"Acevedo, has been privileged by being able to share a stage with Alejandra Guzmán, Guillermo Dávila, Luis Enrique and Víctor Manuelle Mary Ann and Víctor",1
She described her style in singing from Sly Stone and Beyoncé.,1
"Alexander says that many artists have made impacts on him with a few of his biggest inspirations as Erykah Badu, David Bowie, Andre 3000, Jimi Hendrix, Lenny Kravitz, Lorde, Sia and the list goes on for miles.",1
" He cites Fantasia, Chris Daughtry, Adam Lambert, Joshua Ledet and Jena Irene as his all-time favorite AI performers.",1
"Shake It Out by Florence & The Machine, Youth by Daughter, and God From The Machine by Santigold",1
"He also said Lorde was definitely a writer he'd like to work with and that she, Santigold, and Erykah Badu are his favorite and most influential artists because They're each very unique human beings with very distinct voices and styles.",1
"Meuse's musical influences include Coldplay, Miranda Lambert, Creedence Clearwater Revival, Stevie Nicks, Death Cab for Cutie, Bruno Mars, and Shinedown.",1
On his American Idol contestant page he notes his mother influences his musical style,1
"His favorite male artist is Michael Jackson because his style in music is unique and genius, Ledet would model his career like Jackson",1
His favorite female artist is Whitney Houston because of her voice.,1
"He would love to meet and sing with Fantasia Barrino as she is his favorite singer, and his dream song to sing is I Will Always Love You.",1
"His musical influences include Whitney Houston, Michael Jackson, Fantasia Barrino, James Brown, Luther Vandross, Stevie Wonder, and Elton John.",1
"When asked what was the most embarrassing song he listens to, he said Aqua's Barbie Girl.",1
Sheléa is mentored by Stevie Wonder and is a protégée of Quincy Jones.,1
She was a backup singer for Wonder's Songs in the Key of Life Tour in 2014 and 2015.,1
She has stated that Whitney Houston is one of her biggest inspirations.,1
by Australian group Midnight Oil on their album Red Sails in the Sunset.,1
"The influence of Ramnad Krishnan, Semmangudi Srinivasa Iyer, Nedunuri Krishnamurthy and K. V. Narayanaswamy has been observed in his music.",1
"The shop, located in Watts, Los Angeles, on the corner of Vernon and Central, featured a deejay by the name of Dick Hugg, a white guy nicknamed Huggie Boy, who everyone thought was black.",1
"He played records like Gee by The Crows, You're The One” by The Spiders, Shake a Hand by Faye Adams and Money Honey by Clyde McPhatter.",1
"Wash has mentioned Marvin Gaye, R. Kelly and Usher as influences on him.",1
"During the 1970s, Bentonia blues musicians, Jack Owens, Cornelius Bright, Tommy West, Adam Slater, Dodd Stuckey",1
"Slater, Bright and West initially started to teach Holmes how to play, but it took the arrival of Jack Owens at the Blue Front Cafe on a regular basis in the 1980s, before Holmes fully grasped the style.",1
Tee Tot is best known for being a mentor to Hank Williams.  ,1
Rufus Payne met Hank Williams when Hank was eight years old and legend has it,1
"His first exposure to music was by The Beatles, The Rolling Stones, and other British Invasion bands on Dallas AM top 40 radio station KLIF in the 1960s.",1
"His major influences at that point were Lynyrd Skynyrd, The Allman Brothers Band, ZZ Top, Johnny Winter, Led Zeppelin and Rory Gallagher among others.",1
"During these formative years, Suhler was exposed to Texas guitar talent performing in local North Texas nightclubs like Bugs Henderson, Stevie Ray Vaughan, Anson Funderburgh, Jimmie Vaughan and Rocky Hill.",1
"Suhler never had the privilege of sharing the stage with Stevie Ray Vaughan, but he did get the opportunity to meet the blues legend on a couple of occasions, initially in 1989 at his father's jewelry store in Dallas when Vaughan stopped in to have a watch repaired.",1
"They played a few gigs in 1980 at St. Christopher's, one of Stevie Ray Vaughan's Dallas venues at that time.",1
"Suhler was playing a much more traditional form of blues than he is now known for, much in the style of T-Bone Walker, Magic Sam and B.B. King.",1
"Influenced since early childhood by the strong values of Brazilian music, he had a special preference for the sad, dramatic overtones of Cartola, Lupicinio Rodrigues, Dolores Duran, and Maysa.",1
"In late 1974, a vacation in London, England, acquainted him with the music of Led Zeppelin, Janis Joplin and The Rolling Stones, and he soon became a great fan.",1
"Carroll has stated that his music influences range from bands such as Bruce Springsteen, Biffy Clyro, Metallica, Counting Crows, The Ramones to genres such as Jazz and Electronic.",1
"He counts music artists Joy Division, Nirvana, Smashing Pumpkins, Manic Street Preachers, Pixies, Depeche Mode, Nick Drake, Thom Yorke, Placebo and authors Wallace Stevens and James Joyce amongst his influences.",1
"Hause has cited Bruce Springsteen, Tom Petty, The Clash, Bob Dylan, The Beatles, The Hooters, Bryan Adams, Aerosmith, Iron Maiden, Metallica, The Misfits, Sick Of It All, Steve Earle, Tori Amos, The Bouncing Souls, Avail, Patty Griffin, Brandi Carlile, Hot Water Music, Social Distortion, the Ramones and Pearl Jam as influences.",1
"He stated being influenced by bands like Every Time I Die, Architects, Bring Me the Horizon and Asking Alexandria.",1
Mullins is the main songwriter for Memphis May Fire.,1
"Shultz cites bands such as the Pixies as influential on his vocal style, explaining that he discovered them alongside other punk bands while living in England during the recording of Thank You",1
His stage persona is inspired by punk pioneers such as Iggy Pop.,1
"In spite of the facts that Nat King Cole had the #7 song in 1959, and the #1 song in 1961, and Chuck Berry had a major hit with Maybellene in 1955, in the United States in the 1950s legal segregation and discrimination against African Americans was common, especially in the Deep South.",1
"Presley would nevertheless publicly cite his debt to African American music, pointing to artists such as B. B. King, Arthur Big Boy Crudup, Ivory Joe Hunter, and Fats Domino.",1
"Down in Tupelo, Mississippi, I used to hear old Arthur Crudup bang his box the way I do now",1
Little Richard said of Presley: He was an integrator.,1
Elvis was a blessing.,1
"But after Presley purchased the music of  African American Otis Blackwell and had his Gladys Music company hire talented black songwriter Claude Demetrius, the industry underwent a dramatic change.",1
"In the spring of 1957 Presley invited African American performer Ivory Joe Hunter to visit Graceland and the two spent the day together, singing ",1
The popularity of Elvis Presley was similarly founded on his transgressive position with respect to racial and sexual boundaries. ...,1
"White cover versions of hits by black musicians ... often outsold the originals; it seems that many Americans wanted black music without the black people in it, and Elvis had undoubtedly derived his style from the Negro rhythm-and-blues performers of the late 1940s.",1
The Elvis stole black music theme is an enduring one with arguments for and against published in books  ,1
No wonder that Elvis became a symbol of all that was oppressive to the black experience in the Western Hemisphere.,1
"his scholarly work Race, Rock, and Elvis, Tennessee State University professor Michael T. Bertrand examined the relationship between popular culture and social change in America and these allegations against Presley.",1
"However much Elvis may have 'borrowed' from black blues performers (e.g., '",1
"Big Boy' Crudup, 'Big Mama' Thornton), he borrowed no less from white country stars (e.g., Ernest Tubb, Bill Monroe) and white pop singers, and most of his borrowings came from the church; its gospel music was his primary musical influence and foundation. ",1
"According to George Plasketes, several songs by other performers came out after the singer's death which are a part of a demystification process as they portray Elvis as a racist.",1
", David Roediger considers contemporary wiggers in light of the tensions in racial impersonation embodied by Elvis Presley.",1
Chuck D and others have at one point or another publicly condemned Presley for stealing black music.,1
"However, in 2002, Chuck D, in an interview with the Associated Press in connection with the 25th Anniversary of Presley's death, explained how his feelings for Elvis' legacy were no longer those as originally suggested by the lyrics in  ",1
"When  broadcast as a part of the NBC-produced documentary Elvis Lives,  Chuck D had the following to say about Presley.  ",1
Elvis was a brilliant artist.,1
"As a musicologist—and I consider myself one—there was always a great deal of respect for Elvis, especially during his Sun sessions.",1
"(In fact), Eminem is the new Elvis because, number one, he had the respect for black music that Elvis had. ",1
Unhealthy influence over Elvis Presence of the Entourage Elvis's father Vernon increasingly distrusted and disliked many members of the Memphis Mafia as Elvis' financial condition deteriorated in 1972.,1
"Throughout the years, several members of the Memphis Mafia left Elvis' employment, either due to falling out with Vernon Presley or for personal reasons, only to return at later dates.",1
"The most publicized fallout came when Vernon Presley fired Elvis' longtime friends Red West and Sonny West on July 13, 1976. ",1
"Vernon Presley gave the reasons for their firing to be: Elvis' expenses were increasing at an alarming rate, and there were complaints and threats of lawsuits about the manner in which Red West and Sonny West interacted with fans.",1
"After being in Elvis' employment for two decades, both Red West and Sonny West were only paid a few weeks' severance pay.",1
Their requests to speak directly to Elvis about their employment termination and the nominal severance pay were not granted.,1
"Red West, Sonny West, and Elvis himself felt betrayed, and all parties were upset with one another in the manner in which they were fired. ",1
"When Colonel Parker informed Elvis Red West and Sonny West were writing a tell-all book about Elvis, which included the disclosure of Elvis' addiction to prescribed pain medications, Elvis was furious as well as hurt.",1
"Elvis and the Colonel discussed offering Red West and Sonny West a monetary settlement in return for a written agreement the book would not be published, and their experiences with Elvis, on stage and off would remain confidential.",1
"An agreement was not reached, and when Elvis received a copy of the book entitled Elvis, What Happened?",1
"Most of all, Elvis was concerned his daughter Lisa Marie Presley, would be adversely affected by the contents of the book.",1
The publication of the book bothered Elvis on a personal and professional level during the last two weeks of his life. ,1
"In numerous press conferences concerning the book Elvis, What Happened?, both Red West and Sonny West stated they wrote the book, in part, in order to make Elvis realize that his dependence on prescription medications was (literally) killing him.",1
They stated they hoped their book would shock Elvis into seeking medical care away from the physicians who were complicit in prescribing Elvis large amounts of prescription medications and fully resting and becoming clean off of these prescribed drugs.,1
"Substream Magazine states, The newest album Zoetic embraces electronic elements without ignoring Avary’s infallible knack for hooks—think of it as if Trent Reznor, Mutemath and Paper Route formed a supergroup in secret.",1
"Smith's work with DIIV has been described as krautrock, post-punk and shoegaze.",1
"Smith's favorite albums include Arthur Russell's Love Is Overtaking Me (2008),",1
Red Krayola's The Parable of Arable Land (1967) and Faust's The Faust Tapes (1973).,1
"The songs on Oshin were influenced by German psychedelic bands such as Kluster, La Düsseldorf, Neu!",1
and Can.,1
"Additionally, Smith cited Nirvana and world music as sources of inspiration.",1
"According to Smith, Is the Is Are was influenced by Elliott Smith and Royal Trux.",1
"Hölljes, like the rest of Delta Rae, believes in the power of music.",1
She often speaks of the significant impact of the Delta Rae's diehard fans on the band and on her.,1
Christian has stated that his interest in humanitarian efforts has influenced the themes of several of Anberlin's songs.,1
"He has been strongly influenced by Erkan Ogur, Fred Frith, David Tronzo, Derek Bailey and John Cage.",1
Allen has also been an admirer of John Lennon and especially Dani Rabin of Marbin.,1
He participates in and is a founding member of yearly tribute to the life and music of John Lennon.,1
"Performing in the Naumburg Band Shell across from Strawberry Field, hundreds gather each year in the freezing cold to celebrate and remember the music of John Lennon.",1
"Lee early on employed the vocal style called the death grunt or death growl, taking influence from the then Celtic Frost vocalist Thomas Gabriel Fischer (a.k.a. Tom G Warrior).",1
"In 1990, Demir joined a heavy/rock group, Mezarkabul, based in Istanbul and wrote and played guitar in the group's second album, Trail Blazer.",1
